,titulo,descricao,paginas,idioma,editora,autor,genero,imgLink,isbn13,isbn10,amazonLink
18,Introdução à Programação com Python: Algoritmos e Lógica de Programação Para Iniciantes,"Este livro é orientado ao iniciante em programação. Os conceitos básicos de programação, como expressões, variáveis, repetições, decisões, listas, dicionários, conjuntos, funções, arquivos, classes, objetos e banco de dados com SQLite 3 são apresentados um a um com exemplos e exercícios. A obra visa a explorar a programação de computadores como ferramenta do dia a dia. Ela pode ser lida durante um curso de introdução à programação de computadores e usada como guia de estudo para autodidatas. Para aproveitamento pleno do conteúdo, apenas conhecimentos básicos de informática, como digitar textos, abrir e salvar arquivos, são suficientes. Todo software utilizado no livro pode ser baixado gratuitamente, sendo executado em Windows, Linux e Mac OS X.",328 páginas,Português,Novatec Editora; 3ª edição (8 janeiro 2019),Nilo Ney Coutinho Menezes,Tecnologia,https://m.media-amazon.com/images/I/71MIG6Z3F2L._SY385_.jpg,978-8575227183,8575227181,https://www.amazon.com.br/Introdu%C3%A7%C3%A3o-Programa%C3%A7%C3%A3o-com-Python-Algoritmos/dp/8575227181/ref=sr_1_1?__mk_pt_BR=%C3%85M%C3%85%C5%BD%C3%95%C3%91&keywords=python&sr=8-1
19,"Programação em Baixo Nível: C, Assembly e Execução de Programas na Arquitetura Intel 64","Conheça a linguagem Assembly e a arquitetura do Intel 64, torne-se proficiente em C e entenda como os programas são compilados e executados até o nível das instruções de máquina, permitindo-lhe escrever um código robusto e de alto desempenho. ""Programação em baixo nível"" explica a arquitetura do Intel 64 como resultado da evolução da arquitetura de von Neumann. O livro o ensina a usar a versão mais recente da linguagem C (C11) e a linguagem Assembly desde o básico. Todo o caminho, do código-fonte à execução do programa, incluindo a geração de arquivos-objeto ELF, além das ligações estática e dinâmica, será discutido. Há exemplos de código e exercícios, junto com as melhores práticas de programação. Os recursos de otimização e os limites dos compiladores modernos serão analisados, permitindo-lhe promover um equilíbrio entre a legibilidade do programa e o desempenho. O uso de diversas técnicas para ganho de desempenho, por exemplo, instruções SSE e pre-fetching, será demonstrado. Assuntos relevantes em ciência da computação, como os modelos de computação e as gramáticas formais, também serão tratados, explicando-se sua importância prática. Programação em baixo nível ensina os programadores a: escrever livremente em linguagem Assembly; compreender o modelo de programação do Intel 64; escrever um código robusto e fácil de manter em C11.",576 páginas,Português,Novatec Editora; 1ª edição (17 abril 2018),Igor Zhirkov,Tecnologia,https://m.media-amazon.com/images/I/61qFQdEyNJL._SY385_.jpg,978-8575226674,8575226673,https://www.amazon.com.br/Programa%C3%A7%C3%A3o-Baixo-N%C3%ADvel-Programas-Arquitetura/dp/8575226673/ref=sr_1_1?__mk_pt_BR=%C3%85M%C3%85%C5%BD%C3%95%C3%91&keywords=assembly&sr=8-1&ufe=app_do%3Aamzn1.fos.6d798eae-cadf-45de-946a-f477d47705b9
20,PHP & MySQL: Server-Side Web Development,"Learn PHP, the programming language used to build sites like Facebook, Wikipedia and WordPress, then discover how these sites store information in a database (MySQL) and use the database to create the web pages.
This full-color book is packed with inspiring code examples, infographics and photography that not only teach you the PHP language and how to work with databases, but also show you how to build new applications from scratch. It demonstrates practical techniques that you will recognize from popular sites where visitors can:",672 páginas,Inglês,Wiley; 1ª edição (12 abril 2022),Jon Duckett,Tecnologia,https://m.media-amazon.com/images/I/61b2v8YFeLL._SY385_.jpg,978-1119149217,1119149215,https://www.amazon.com.br/PHP-MySQL-Server-side-Web-Development/dp/1119149215/ref=sr_1_3?__mk_pt_BR=%C3%85M%C3%85%C5%BD%C3%95%C3%91&keywords=php&sr=8-3&ufe=app_do%3Aamzn1.fos.6a09f7ec-d911-4889-ad70-de8dd83c8a74
21,Desenvolvendo Websites com PHP: Aprenda a Criar Websites Dinâmicos e Interativos com PHP e Bancos de Dados,"Desenvolvendo Websites com PHP apresenta técnicas de programação fundamentais para o desenvolvimento de sites dinâmicos e interativos. Você aprenderá a desenvolver sites com uma linguagem utilizada em milhões de sites no mundo inteiro. O livro abrange desde noções básicas de programação até a criação e manutenção de bancos de dados, mostrando como são feitas inclusões, exclusões, alterações e consultas a tabelas de uma base de dados.
O autor apresenta diversos exemplos de programas para facilitar a compreensão da linguagem. Nesta obra, você irá encontrar os seguintes tópicos:",320 páginas,Português,Novatec Editora; 3ª edição (9 dezembro 2016),Juliano Niederauer,Tecnologia,https://m.media-amazon.com/images/I/81jSsW0P15L._SY385_.jpg,978-8575225349,8575225340,https://www.amazon.com.br/Desenvolvendo-Websites-com-PHP-Interativos/dp/8575225340/ref=sr_1_1?__mk_pt_BR=%C3%85M%C3%85%C5%BD%C3%95%C3%91&keywords=php&sr=8-1
22,Lógica de Programação e Algoritmos com JavaScript: uma Introdução à Programação de Computadores com Exemplos e Exercícios Para Iniciantes,"Os conteúdos abordados em Lógica de Programação e Algoritmos são fundamentais a todos aqueles que desejam ingressar no universo da Programação de Computadores. Esses conteúdos, no geral, impõem algumas dificuldades aos iniciantes. Neste livro, o autor utiliza sua experiência de mais de 15 anos em lecionar a disciplina de Algoritmos em cursos de graduação, para trabalhar o assunto passo a passo. Cada capítulo foi cuidadosamente planejado a fim de evitar a sobrecarga de informações ao leitor, com exemplos e exercícios de fixação para cada assunto.
Os exemplos e exercícios são desenvolvidos em JavaScript, linguagem amplamente utilizada no desenvolvimento de páginas para a internet. Rodar os programas JavaScript não exige nenhum software adicional; é preciso apenas abrir a página em seu navegador favorito.
Nesta 2ª edição, além da atualização dos códigos e recursos do JavaScript, foram acrescentados três novos capítulos sobre Node.js, Express e React. Com Node.js é demonstrado como construir Algoritmos da forma “tradicional”, com a entrada e saída de dados via prompt de comandos. Com o Express é desenvolvida uma aplicação back-end com persistência em banco de dados – que recebe e envia dados no formato JSON. E, com o React, é criada a aplicação de front-end, que vai interagir com o usuário e acessar o back-end. São desenvolvidas rotinas de cadastro, pesquisa, exibição de dados estatísticos e criação de gráficos.
Como o aprendizado de Algoritmos ocorre a partir do estudo das técnicas de programação e da prática de exercícios, este livro pretende ser uma importante fonte de conhecimentos para você ingressar nessa fascinante área da programação de computadores.
Os capítulos cobrem os temas abordados na disciplina de Algoritmos: entrada e saída de dados, condições, repetições, vetores, strings, datas, funções com passagem e retorno de parâmetros, depuração de programas – além de tratar assuntos relacionados à construção de páginas Web com JavaScript.",352 páginas,Português,Novatec Editora; 2ª edição (18 março 2022),Edécio Fernando Iepsen,Tecnologia,https://m.media-amazon.com/images/I/71X7hMhMEUL._SY385_.jpg,978-6586057904,6586057906,https://www.amazon.com.br/L%C3%B3gica-Programa%C3%A7%C3%A3o-Algoritmos-com-JavaScript/dp/6586057906/ref=sr_1_3?__mk_pt_BR=%C3%85M%C3%85%C5%BD%C3%95%C3%91&keywords=javascript&sr=8-3
23,JavaScript: O Guia Definitivo,"Referência completa para programadores, JavaScript: O guia definitivo fornece uma ampla descrição da linguagem JavaScript básica e das APIs JavaScript do lado do cliente definidas pelos navegadores Web. Em sua 6ª edição, cuidadosamente reescrita para estar de acordo com as melhores práticas de desenvolvimento Web atuais, abrange ECMAScript 5 e HTML5 e traz novos capítulos que documentam jQuery e JavaScript do lado do servidor. Recomendado para programadores experientes que desejam aprender a linguagem de programação da Web e para programadores JavaScript que desejam ampliar seus conhecimentos e dominar a linguagem, este é o guia do programador e manual de referência de JavaScript completo e definitivo.",1080 páginas,Português,Bookman; 6ª edição (1 janeiro 2012),David Flanagan,Tecnologia,https://m.media-amazon.com/images/I/91z1xY4ppaL._SY385_.jpg,978-8565837194,856583719X,https://www.amazon.com.br/JavaScript-Guia-Definitivo-David-Flanagan/dp/856583719X/ref=sr_1_1?__mk_pt_BR=%C3%85M%C3%85%C5%BD%C3%95%C3%91&keywords=javascript&sr=8-1&ufe=app_do%3Aamzn1.fos.6121c6c4-c969-43ae-92f7-cc248fc6181d
