,titulo,descricao,paginas,idioma,editora,autor,genero,imgLink,isbn13,isbn10,amazonLink
0,E não sobrou nenhum - Edição de luxo,"Eleito o melhor romance policial da história, E não sobrou nenhum ganha edição de luxo com capa dura

Considerado o melhor livro de suspense de todos os tempos, E não sobrou nenhum reúne pela primeira vez elementos que se tornaram clássicos das tramas policiais, seja na literatura, em seriados ou no cinema: uma ilha isolada, uma impressionante mansão, uma festa de gala e personagens que são todos suspeitos em potencial.

Lançado originalmente em 1939,",336 páginas,Português,Globo Livros; 5ª edição (13 dezembro 2021),Agatha Christie,Terror,https://m.media-amazon.com/images/I/611QlD9s+rL._SY385_.jpg,978-6559870332,6559870332,https://www.amazon.com.br/n%C3%A3o-sobrou-nenhum-Edi%C3%A7%C3%A3o-luxo/dp/6559870332/ref=tmm_hrd_swatch_0?_encoding=UTF8&qid=&sr=
1,Estado de terror,"“Reunindo uma ex-secretária de Estado e uma das autoras de mistério mais celebradas da atualidade, Estado de terror combina detalhes dos bastidores políticos com ação de tirar o fôlego, em uma trama de ameaça global à altura dos melhores suspenses.” – The Wall Street Journal",464 páginas,Português,Editora Arqueiro; 1ª edição (7 março 2023),Louise Penny,Terror,https://m.media-amazon.com/images/I/81hiifpZU2L._SY385_.jpg,978-6555654509,6555654503,https://www.amazon.com.br/Estado-terror-Louise-Penny/dp/6555654503/ref=tmm_pap_swatch_0?_encoding=UTF8&qid=&sr=1-8
2,Histórias extraordinárias,"A edição ilustrada inclui textos de Charles Baudelaire, Jorge Luis Borges e Julio Cortázar, que reverenciam o estilo hipnotizante do escritor mais sombrio de todos os tempos.

Histórias extraordinárias reúne dezoito contos assombrosos de Edgar Allan Poe, com seleção, apresentação e tradução do poeta José Paulo Paes. Este livro traz, entre outras obras-primas do mestre do suspense e do mistério, ""A carta roubada"", ""O gato preto"", ""O escaravelho de ouro"", ""O poço e o pêndulo"" e ""O homem da multidão"".
O caráter macabro das histórias, dotadas de profundidade psicológica e imersas em uma atmosfera eletrizante, continua a conquistar novos leitores e a afirmar sua condição de clássico. Nas palavras de Paes, ""Poe sempre consegue […] provocar-nos aquele arrepio de morte ou aquela impressão de vida que, em literatura, constituem o melhor, senão o único, passaporte para a imortalidade"".",448 páginas,Português,Companhia das Letras; 1ª edição (28 novembro 2017),Edgar Allan Poe,Terror,https://m.media-amazon.com/images/I/91J4ze7NJlL._SY385_.jpg,978-8535930030,8535930035,https://www.amazon.com.br/Hist%C3%B3rias-extraordin%C3%A1rias-Edgar-Allan-Poe/dp/8535930035/ref=tmm_hrd_swatch_0?_encoding=UTF8&qid=&sr=
3,Box Terríveis Mestres (3 livros + pôster + suplemento),"BOX EXCLUSIVO REUNINDO TRÊS MESTRES DA LITERATURA: EDGAR ALLAN POE, H.P. LOVECRAFT E ARTHUR CONAN DOYLE Chegou a noite. O extraordinário que arrepia. O estranho que nos arrebata. A imaginação que nos assombra. Essas são algumas das sensações que podemos sentir – e apenas tentar explicar em palavras – ao ler autores como Edgar Allan Poe, H.P. Lovecraft e Sir Arthur Conan Doyle, pela primeira vez reunidos neste box exclusivo. Aqui, você encontrará um compilado de histórias essenciais para quem sempre preferiu as sombras: 6 “Histórias primordiais” de Poe, responsável por, de certa maneira, criar os contos de terror; 6 “Histórias favoritas” de Lovecraft, eleitas pelos fãs do autor em pesquisa da comunidade The H.P. Lovecraft Archive; e 6 “Histórias de horror” de Doyle, o maior contista policial da história numa faceta desconhecida como a noite, mas essencial como nossa adoração por ela. Chegou a hora de explorar os seus instintos. Boa sorte.",676 páginas,Português,Novo Século; 1ª edição (16 março 2020),Edgar Allan Poe,Terror,https://m.media-amazon.com/images/I/71XQQ1AV6EL._SY385_.jpg,978-8542816938,8542816935,https://www.amazon.com.br/Terr%C3%ADveis-Mestres-livros-p%C3%B4ster-suplemento/dp/8542816935/ref=sr_1_3?__mk_pt_BR=%C3%85M%C3%85%C5%BD%C3%95%C3%91&keywords=terror&s=books&sr=1-3
4,It: A coisa,"Nesse clássico que inspirou os filmes da Warner, um grupo de amigos conhecido como Clube dos Otários aprende o real sentido da amizade, do amor, da confiança... e do medo. O mais profundo e tenebroso medo.",1104 páginas,Português,Suma; 1ª edição (24 julho 2014),Stephen King,Terror,https://m.media-amazon.com/images/I/91g9Dvtf+jL._SY385_.jpg,978-8560280940,8560280944,https://www.amazon.com.br/coisa-Stephen-King/dp/8560280944/ref=tmm_pap_swatch_0?_encoding=UTF8&qid=&sr=
5,Laranja Mecânica: Edição Comemorativa de 50 anos,"Publicado pela primeira vez em 1962, e imortalizado 9 anos depois pelo filme de Stanley Kubrick, Laranja Mecânica não só está entre os clássicos eternos da ficção como representa um marco na cultura pop do século 20. Meio século depois, a perturbadora história de Alex – membro de uma gangue de adolescentes que é capturado pelo Estado e submetido a uma terapia de condicionamento social – continua fascinando, e desconcertando, leitores mundo afora. Esta edição especial de 50 anos em capa dura e impressa em duas cores (preto e laranja), inclui: * Ilustrações exclusivas de Angeli, Dave McKean e Oscar Grillo * Trechos do livro restaurados pelo editor inglês * Notas culturais do editor * Artigos e ensaios escritos pelo autor, inéditos em língua portuguesa * Uma entrevista inédita com Anthony Burgess * Reprodução de seis páginas do manuscrito original, com anotações e ilustrações do autor",352 páginas,Português,Editora Aleph; 1ª edição (21 novembro 2012),Anthony Burgess,Terror,https://m.media-amazon.com/images/I/61t3Oh8AK-L._SY385_.jpg,978-8576571360,8576571366,https://www.amazon.com.br/Laranja-mec%C3%A2nica-Anthony-Burgess/dp/8576571366/ref=tmm_hrd_swatch_0?_encoding=UTF8&qid=&sr=
6,O cemitério,"O livro que inspirou o filme O cemitério maldito. Louis Creed, um jovem médico de Chicago, acredita que encontrou seu lugar em uma pequena cidade do Maine. A boa casa, o trabalho na universidade e a felicidade da esposa e dos filhos lhe trazem a certeza de que fez a melhor escolha. Num dos primeiros passeios pela região, conhecem um cemitério no bosque próximo à sua casa. Ali, gerações de crianças enterraram seus animais de estimação. Mas, para além dos pequenos túmulos, há um outro cemitério. Uma terra maligna que atrai pessoas com promessas sedutoras. Um universo dominado por forças estranhas capazes de tornar real o que sempre pareceu impossível. A princípio, Louis Creed se diverte com as histórias fantasmagóricas do vizinho Crandall. No entanto, quando o gato de sua filha Eillen morre atropelado e, subitamente, retorna à vida, ele percebe que há coisas que nem mesmo a sua ciência pode explicar. Que mistérios esconde o cemitério dos bichos? Terá o homem o direito de interferir no mundo dos mortos? Em busca das respostas, Louis Creed é levado por uma trama sobrenatural em que o limite entre a vida e a morte é inexistente. E, quando descobre a verdade, percebe que ela é muito pior que seus mais terríveis pesadelos. Pior que a própria morte - e infinitamente mais poderosa. A Capa Pode Variar.",424 páginas,Português,Suma; 1ª edição (24 abril 2013),Mário Molina,Terror,https://m.media-amazon.com/images/I/8151ymQnnuL._SY385_.jpg,978-8581050393,8581050395,https://www.amazon.com.br/cemit%C3%A9rio-Stephen-King/dp/8581050395/ref=tmm_pap_swatch_0?_encoding=UTF8&qid=&sr=8-1
7,Ghost Story,"Na pacata cidadezinha de Milburn, nos Estados Unidos, a Sociedade Chowder ― formada por um grupo de quatro velhos amigos ― se reúne todo mês para contar histórias em encontros regados a bebidas e charutos. Algumas são verdadeiras, outras inventadas... mas todas elas têm algo em comum: são terrivelmente assustadoras. Um passatempo simples para conferir um pouco de diversão a suas vidas monótonas. Mas uma história chega para mostrar suas garras no presente e assombrá-los. Algo que eles fizeram muito tempo atrás. Um erro grotesco. Um acidente terrível. Agora, pesadelos fazem com que eles inevitavelmente sejam atraídos pelo sobrenatural. E não demora muito para que eles percebam que ninguém pode enterrar o passado para sempre… Há quase sete anos, os fãs do terror encontraram na DarkSide® um lar. Ou, bem, uma mansão assombrada. Desde então, a Caveira republicou clássicos, revelou novos talentos e fez muita gente se revirar na cama com pesadelos. Os nomes mais assustadores da literatura entraram para a família: Clive Barker, William Hjortsberg, Stephen King, William Peter Blatty… E, agora, Peter Straub. É com o coração assombrado por fantasmas que a DarkSide® apresenta o clássico Ghost Story, uma das histórias sobrenaturais mais surpreendentes já escritas ― e uma das mais aguardadas pelos leitores que caminham de mãos dadas com a Caveira desde o início. Em Ghost Story, Straub mostra seu talento ao apresentar cada membro da Sociedade Chowder para o leitor, ao mesmo tempo em que estabelece a atmosfera da cidadezinha fictícia e os acontecimentos sobrenaturais. Uma leitura compassada, que se esgueira para os cantos mais sombrios da mente, para nunca mais sair. Straub mexe profundamente com a cabeça do leitor em um terror psicológico que aborda arrependimentos, vinganças, amizades que se desmancham e histórias mal-resolvidas ― mas também faz o sangue congelar ao colocar olhos amarelos à espreita e crianças estranhas olhando pela janela. Fantasmas são manifestações reais ou meros ecos do passado? Só lendo para descobrir. Peter Straub se tornou um dos autores de horror mais prolíficos e aclamados de todos os tempos, com inúmeros romances, contos, poemas e novelas publicadas. Entre os leitores notáveis de seu trabalho encontra-se Stephen King, também amigo pessoal e parceiro criativo em obras como O Talismã e A Casa Negra. Ghost Story chega para os leitores no timing perfeito para virar a leitura favorita de Halloween. O padrão de qualidade é o que você já conhece: uma edição de colecionador, feita de fã para fã, para assombração nenhuma colocar defeito. Preparado para encarar os fantasmas desta história?",448 páginas,Português,Darkside; 1ª edição (12 novembro 2019),Peter Straub,Terror,https://m.media-amazon.com/images/I/91ELUwI+e8L._SY385_.jpg,978-8594541840,8594541848,https://www.amazon.com.br/Ghost-Story-Peter-Straub/dp/8594541848/ref=tmm_hrd_swatch_0?_encoding=UTF8&qid=&sr=
8,O vilarejo,"lustrações coloridas dão vida a romance com elementos de horror gótico e suspense.
Do criador da série original Netflix ""Bom dia, Verônica"".
Em 1589, o padre e demonologista Peter Binsfeld fez a ligação de cada um dos pecados capitais a um demônio, supostamente responsável por invocar o mal nas pessoas. É a partir daí que Raphael Montes cria sete histórias situadas em um vilarejo isolado, apresentando a lenta degradação dos moradores do lugar, e pouco a pouco o próprio vilarejo vai sendo dizimado, maculado pela neve e pela fome.
As histórias podem ser lidas em qualquer ordem, sem prejuízo de sua compreensão, mas se relacionam de maneira complexa, de modo que ao término da leitura as narrativas convergem para uma única e surpreendente conclusão.",96 páginas,Português,Suma; 1ª edição (14 agosto 2015),Raphael Montes,Terror,https://m.media-amazon.com/images/I/81JaIN9NExL._SY385_.jpg,978-8581053042,8581053041,https://www.amazon.com.br/vilarejo-Raphael-Montes/dp/8581053041/ref=tmm_pap_swatch_0?_encoding=UTF8&qid=&sr=
9,"Carmilla - A vampira de Karnstein +: O Vampiro, de John William Polidori","Essa edição traz a primeira vampira da história e também a primeira história de vampiro já escrita em projeto gráfico especial, com curiosidades sobre as obras e os autores. Carmilla é uma obra precursora da temática de vampiros, considerada por muitos críticos como a melhor do século XIX, pela maneira como trabalha o suspense e o erotismo. Foi a partir dela que Drácula, de Bram Stoker, recebeu suas principais características. A vampira de Karnstein se torna o motivo dos horrores e depois do desejo profundo de Laura, uma jovem que vive somente na companhia do pai em um castelo isolado no Leste Europeu. O Vampiro, de John William Polidori, concretizou as lendas folclóricas sobre vampiro e deu a ele a cara que tem ainda hoje: um demônio aristocrata que ataca entre a alta sociedade.",176 páginas,Português,Pandorga Editora; 1ª edição (13 setembro 2021),Le Fanu J. Sheridan,Terror,https://m.media-amazon.com/images/I/614j-lJ6BnL._SY385_.jpg,978-6555791044,6555791047,https://www.amazon.com.br/Carmilla-vampira-Karnstein-Vampiro-Polidori/dp/6555791047/ref=sr_1_9?__mk_pt_BR=%C3%85M%C3%85%C5%BD%C3%95%C3%91&keywords=terror&s=books&sr=1-9
10,A Hora do Vampiro,"Publicado originalmente em 1975, Salem é inspirado em Drácula de Bram Stoker. Segundo livro da carreira de King, a obra deu origem ao filme Os vampiros de Salem. Ambientado na cidadezinha de Jerusalem's Lot, na Nova Inglaterra, o romance conta a história de três forasteiros. Ben Mears, um escritor que viveu alguns anos na cidade quando criança e está disposto a acertar contas com o próprio passado; Mark Petrie, um menino obcecado por monstros e filmes de terror; e o sr. Barlow, uma figura misteriosa que decide abrir uma loja na cidade. Após a chegada desses forasteiros, fatos inexplicáveis vêm perturbar a rotina provinciana de Jerusalem's Lot: uma criança é encontrada morta; habitantes começam a desaparecer sem deixar vestígios ou sucumbem a uma estranha doença. A morte passa a envolver a pequena cidade com seu toque maléfico e Ben e Mark são obrigados a escolher o único caminho que resta aos sobreviventes da praga: fugir. Mas isso não será tão simples. Os destinos de Ben, Mark, Barlow e Jerusalem's Lot estão agora para sempre interligados. E é chegada a hora do inevitável acerto de contas.",576 páginas,Português,Ponto de leitura; Edição de bolso (14 maio 2010),Stephen King,Terror,https://m.media-amazon.com/images/I/71nFPaw1UUL._SY385_.jpg,978-8539000654,8539000652,https://www.amazon.com.br/Hora-do-Vampiro-Stephen-King/dp/8539000652/ref=sr_1_1?__mk_pt_BR=%C3%85M%C3%85%C5%BD%C3%95%C3%91&keywords=A+Hora+do+Vampiro&sr=8-1
11,O médico e o monstro,"Poucos clássicos da literatura são tão conhecidos e adorados como O médico e o monstro. Escrito quando o autor tinha trinta e cinco anos de idade, em 1885, o romance foi um sucesso imediato de público e inseriu Robert Louis Stevenson no grupo seleto dos grandes escritores da literatura universal. Ao narrar as experiências de um médico que, numa “noite maldita”, tomou uma poção fumegante de coloração avermelhada e descobriu “a dualidade absoluta e primordial do homem”, o autor escocês criou uma história de suspense e horror, em que o perigo iminente não está do lado de fora, mas do lado de dentro, na parte obscura da alma. Esta edição, além de uma introdução de Robert Mighall, Ph.D. em ficção gótica e ciência médico-legal vitoriana na Universidade de Wales, conta com um prefácio do escritor Luiz Alfredo Garcia-Roza, que define o romance como “um dos mais perfeitos e provavelmente o mais famoso romance de mistério da literatura de língua inglesa”.",160 páginas,Português,Penguin-Companhia; 1ª edição (4 março 2015),Robert Louis Stevenson,Terror,https://m.media-amazon.com/images/I/91cVEVZIuYS._SY385_.jpg,978-8582850138,8582850131,https://www.amazon.com.br/m%C3%A9dico-monstro-Robert-Louis-Stevenson/dp/8582850131/ref=sr_1_2?__mk_pt_BR=%C3%85M%C3%85%C5%BD%C3%95%C3%91&keywords=O+M%C3%A9dico+e+o+Monstro&sr=8-2
12,Hellraiser - Renascido do Inferno: Os cenobitas estão chegando,"Um livro tão assustador que nenhuma editora nacional teve a coragem de lançar. Mas não pense que você está a salvo. A DarkSide® Books traz para o Brasil o tão aguardado HELLRAISER - RENASCIDO DO INFERNO, o romance que fez de Clive Barker uma lenda viva do terror. O livro chega às livrarias em setembro de 2015, às vésperas do aniversário de 30 anos de seu lançamento internacional.Escrito em 1986, HELLRAISER - RENASCIDO DO INFERNO apresentou ao público os demoníacos Cenobitas, personagens criados por Clive Barker que hoje figuram no seleto grupo de vilões ícones da cultura pop como Jason, Leatherface ou Darth Vader. Toda a perversidade desses torturadores eternos está presente em detalhes que estimulam a imaginação dos leitores e superam, de longe, o horror do cinema.Clive Barker escreveu o romance HELLRAISER - RENASCIDO DO INFERNO (The Hellbound Heart, no original) já com a intenção de adaptá-lo ao cinema. O cultuado filme de 1987 seria sua estreia na direção, e ele usou o livro para mostrar todo seu talento como contador de histórias a possíveis financiadores. Nas palavras do próprio Barker: “A única maneira foi escrever o romance com a intenção específica de filmá-lo. Foi a primeira e única vez que fiz assim, e deu resultado”.ABRA A CAIXA AGORADe leitura rápida e devastadora, HELLRAISER - RENASCIDO DO INFERNO conta a história de um homem obcecado por prazeres pouco convencionais que é tragado para o inferno. Inspirado nas afinidades peculiares do autor, o sadomasoquismo é um tema constante em sua arte.Se você é fã de Clive Barker, precisa ler sua primeira obra-prima. O mestre sombrio finalmente chegou à DarkSide®.Para matar os desejos de todos os fãs, e prontos para comemorar os 30 anos de seu lançamento, HELLRAISER - RENASCIDO DO INFERNO chega às livrarias em duas edições como só a DarkSide® Books sabe fazer: Limited Edition (capa dura) e Classic Edition (com a revolucionária capa com book frame®).",160 páginas,Português,Darkside; 1ª edição (6 maio 2019),Clive Barker,Terror,https://m.media-amazon.com/images/I/71DhK115WHL._SY385_.jpg,978-8566636697,8566636694,https://www.amazon.com.br/Hellraiser-Renascido-Inferno-Clive-Barker/dp/8566636694/ref=sr_1_1?__mk_pt_BR=%C3%85M%C3%85%C5%BD%C3%95%C3%91&keywords=Hellraiser&sr=8-1
13,A assombração da Casa da Colina (Nova edição),"Considerada a rainha do terror por mestres como Stephen King e Neil Gaiman, Shirley Jackson cria uma obra perturbadora sobre a relação entre a loucura e o sobrenatural. A assombração da Casa da Colina é considerada a melhor história de casa assombrada de todos os tempos e inspirou a série original Netflix A Maldição da Residência Hill.
Sozinha no mundo, Eleanor fica encantada ao receber uma carta do dr. Montague convidando-a para passar um tempo na Casa da Colina, um local conhecido por suas manifestações fantasmagóricas. O mesmo convite é feito a Theodora, uma alma artística e sensitiva, e a Luke, o herdeiro da mansão. Porém, o que começa como uma exploração bem-humorada de um mito inocente se transforma em uma viagem para os piores pesadelos de seus hóspedes. Com o tempo, fica cada vez mais claro que a sanidade ― e a vida ― de todos está em risco.",200 páginas,Português,Alfaguara; 2ª edição (26 julho 2021),Shirley Jackson,Terror,https://m.media-amazon.com/images/I/81T8UStK1XS._SY385_.jpg,978-8556521149,8556521142,https://www.amazon.com.br/assombra%C3%A7%C3%A3o-Casa-Colina-Nova-edi%C3%A7%C3%A3o/dp/8556521142/ref=sr_1_1?__mk_pt_BR=%C3%85M%C3%85%C5%BD%C3%95%C3%91&keywords=A+Assombra%C3%A7%C3%A3o+da+Casa+da+Colina&sr=8-1
14,O silêncio dos inocentes,"Uma corajosa agente do FBI arrisca sua vida na tentativa de solucionar um crime misterioso. Mas para isso, ela precisa da ajuda do Dr. Hannibal Lecter, um serial killer brutal. Livro que inspirou o clássico do cinema O silêncio dos inocentes, vencedor do Oscar de Melhor Filme e Melhor Roteiro Adaptado.
 Cinco mulheres são brutalmente assassinadas em diferentes localidades dos Estados Unidos pelo serial killer apelidado de Buffalo Bill. A jovem agente do FBI, Clarice Starling, fica surpresa ao ser chamada por Jack Crawford, chefe da Divisão de Ciência do Comportamento. Sua missão: interrogar o ardiloso psiquiatra Hannibal Lecter, mantido no Hospital Estadual de Baltimore para Criminosos com Transtornos Mentais, cuja mente psicopata é perigosamente voltada para o crime, mas pode se mostrar útil para o caso, ainda que ele jamais tenha cooperado com as forças da lei.",360 páginas,Português,Record; 22º edição (9 setembro 2019),Thomas Harris,Terror,https://m.media-amazon.com/images/I/91ETm9i7AAL._SY385_.jpg,978-8501113627,850111362X,https://www.amazon.com.br/sil%C3%AAncio-dos-inocentes-Thomas-Harris/dp/850111362X/ref=sr_1_1?__mk_pt_BR=%C3%85M%C3%85%C5%BD%C3%95%C3%91&keywords=O+Sil%C3%AAncio+dos+Inocentes&sr=8-1
15,Drácula - Dark Edition,"Edição Limitada para caçadores de vampiros!
Drácula, um clássico que ainda corre quente na veia de inúmeras gerações de leitores por todo o mundo e a mais celebrada narrativa de vampiros, continua a transcender fronteiras de tempo, espaço, história e memória.
Mais de 120 anos após sua primeira publicação, o romance epistolar mobiliza leitores e estudiosos, confirmando o vigor perene de uma árvore cujas sólidas raízes respondem pela vitalidade de suas ramificações. Embora o famoso conde não tenha sido o primeiro vampiro literário, certamente é o mais popular, sugado e adaptado para inúmeros universos: teatro, cinema, quadrinhos, séries e brinquedos, o semblante é reconhecido até mesmo por aqueles que nunca leram o romance. Ele está em todos os lugares.",580 páginas,Português,Darkside; 1ª edição (24 outubro 2018),Bram Stoker,Terror,https://m.media-amazon.com/images/I/71eyN+ZYvCL._SY385_.jpg,978-8566636239,8566636236,https://www.amazon.com.br/Dr%C3%A1cula-Bram-Stoker/dp/8566636236/ref=sr_1_1?__mk_pt_BR=%C3%85M%C3%85%C5%BD%C3%95%C3%91&keywords=Dr%C3%A1cula&sr=8-1
16,O Exorcista,"Um clássico com mais de 13 milhões de exemplares vendidos. Uma obra que mudou a cultura pop para sempre. O livro que deu origem ao maior filme de terror de todos os tempos.
Quatro décadas após chocar o mundo inteiro, O exorcista permanece uma metáfora moderna do combate entre o sagrado e o profano, em um dos romances mais macabros já escritos.",336 páginas,Português,HarperCollins; 1ª edição (12 agosto 2019),William Peter Blatty,Terror,https://m.media-amazon.com/images/I/91fQ51I4TRL._SY385_.jpg,978-8595086234,8595086230,https://www.amazon.com.br/Exorcista-William-Peter-Blatty/dp/8595086230/ref=sr_1_1?__mk_pt_BR=%C3%85M%C3%85%C5%BD%C3%95%C3%91&keywords=O+Exorcista&sr=8-1
17,Psicose,"Psicose, o clássico de Robert Bloch, foi publicado originalmente em 1959, livremente inspirado no caso do assassino de Wisconsin, Ed Gein. O protagonista Norman Bates, assim como Gein, era um assassino solitário que vivia em uma localidade rural isolada, teve uma mãe dominadora, construiu um santuário para ela em um quarto e se vestia com roupas femininas.
Em Psicose, sem edição no Brasil há 50 anos, Bloch antecipou e prenunciou a explosão do fenômeno serial killer do final dos anos 1980 e começo dos 1990. O livro, assim com o filme de Hitchcock, tornou-se um ícone do horror, inspirando um número sem fim de imitações inferiores, assim como a criação de Bloch, o esquizofrênico violento e travestido Bates, tornou-se um arquétipo do horror incorporado a cultura pop.",240 páginas,Português,Darkside; Classic edição (20 julho 2013),Robert Bloch,Terror,https://m.media-amazon.com/images/I/61tRMLi4YlL._SY385_.jpg,978-8566636154,8566636155,https://www.amazon.com.br/Psicose-Robert-Bloch/dp/8566636155/ref=tmm_pap_swatch_0?_encoding=UTF8&sr=8-1
18,O iluminado,"O romance, magistralmente levado ao cinema por Stanley Kubrick, continua apaixonando (e aterrorizando) novas gerações de leitores. A luta assustadora entre dois mundos. Um menino e o desejo assassino de poderosas forças malignas. Uma família refém do mal. Nesta guerra sem testemunhas, vencerá o mais forte. Danny Torrance não é um menino comum. É capaz de ouvir pensamentos e transportar-se no tempo. Danny é iluminado. Será uma maldição ou uma bênção? A resposta pode estar guardada na imponência assustadora do hotel Overlook. Em O iluminado, quando Jack Torrance consegue o emprego de zelador no velho hotel, todos os problemas da família parecem estar solucionados. Não mais o desemprego e as noites de bebedeiras. Não mais o sofrimento da esposa, Wendy. Tranquilidade e ar puro para o pequeno Danny livrar-se das convulsões que assustam a família. Só que o Overlook não é um hotel comum. O tempo esqueceu-se de enterrar velhos ódios e de cicatrizar antigas feridas, e espíritos malignos ainda residem nos corredores. O hotel é uma chaga aberta de ressentimento e desejo de vingança. É uma sentença de morte. E somente os poderes de Danny podem fazer frente à disseminação do mal.",464 páginas,Português,Suma; 1ª edição (19 novembro 2012),Stephen King,Terror,https://m.media-amazon.com/images/I/8147kKLLvOL._SY385_.jpg,978-8581050485,8581050484,https://www.amazon.com.br/iluminado-Stephen-King/dp/8581050484/ref=sr_1_1?__mk_pt_BR=%C3%85M%C3%85%C5%BD%C3%95%C3%91&keywords=O+Iluminado&sr=8-1
